{
  "schema_version": 1,
  "name": "hbf-stage3-4x512gib-reference-proposal",
  "stack_count": 4,
  "modules_per_stack": 16,
  "total_capacity_bytes": 2199023255552,
  "total_service_bandwidth_bytes_per_s": 512000000000,
  "link_profile": "hbf-stage2-reference-link.json",
  "media_profile": "../nominal.json",
  "ncdus": 1,
  "banks_per_die": 16,
  "buffers_per_bank": 2,
  "upstream_topology": "independent",
  "coalescing": true,
  "buffer_cache": false,
  "software_limits": {
    "max_parent_requests": 1024,
    "max_child_records": 4096,
    "max_read_bytes": 65536,
    "max_backing_ranges": 1024,
    "host_reassembly_capacity_bytes": 4194304
  }
}
