{
  "schema_version": 1,
  "name": "stage3-two-stack-two-module-16k-cpu-fixture",
  "stack_count": 2,
  "modules_per_stack": 2,
  "total_capacity_bytes": 33554432,
  "total_service_bandwidth_bytes_per_s": 256000000000,
  "link_profile": "hbf-stage3-16k-small-link.json",
  "media_profile": "../nominal.json",
  "ncdus": 1,
  "banks_per_die": 2,
  "buffers_per_bank": 2,
  "upstream_topology": "independent",
  "coalescing": true,
  "buffer_cache": false,
  "software_limits": {
    "max_parent_requests": 4,
    "max_child_records": 1024,
    "max_read_bytes": 16384,
    "max_backing_ranges": 4,
    "host_reassembly_capacity_bytes": 65536
  }
}
